{"artifactCount":3,"artifacts":[{"artifactId":"bundle-readme","licenseSpdx":"MIT","mediaType":"text/markdown; charset=utf-8","path":"README.md","provenance":{"dependsOnArtifactIds":[],"derivation":"authored","sourceReferenceId":"oridesign-neg-path-bounded-finite-angles-candidate-v1","sourceUse":"project-authored"},"role":"readme","sha256":"sha256:5324d52b3160b8190cab03b34a5eadfadc19e19fec6ae3cfaa5c1314f7c238c6"},{"artifactId":"control-fold","licenseSpdx":"MIT","mediaType":"application/json","path":"control-fold.json","provenance":{"dependsOnArtifactIds":[],"derivation":"authored","sourceReferenceId":"oridesign-neg-path-bounded-finite-angles-candidate-v1","sourceUse":"project-authored"},"role":"accepted-control","sha256":"sha256:960b4bb7bcd8424baeb0cf1a52fcb2d295f3caf29f56ebab828cd0398959df1c"},{"artifactId":"source-path-bounded-finite-angles","licenseSpdx":"MIT","mediaType":"application/json","path":"path-bounded-finite-angles.json","provenance":{"dependsOnArtifactIds":["control-fold"],"derivation":"mutated-from-control","sourceReferenceId":"oridesign-neg-path-bounded-finite-angles-candidate-v1","sourceUse":"project-authored"},"role":"negative-source","sha256":"sha256:dfe94b4927ca174f40464fd153fdaa4bb2be5592106dad25f0aca4b0e66e4d36"}],"canonicalManifestPath":"tests/fixtures/manifest.json","canonicalManifestRegistration":"not-registered","canonicalPathMutationFamilyComplete":false,"canonicalPromotionClaimed":false,"caseCount":1,"cases":[{"caseId":"NEG-PATH-MUTATION-BOUNDED-FINITE-ANGLES","caseIndex":0,"changedPaths":["$.pathCandidate.segments[0].motion.anglesByCrease[0].angles[0]"],"controlArtifactId":"control-fold","expectedIssues":[{"code":"non-finite-number","path":"$.pathCandidate.segments[0].motion.anglesByCrease[0].angles[0]"}],"expectedOutcome":"rejected","mutationKind":"replace-first-bounded-interpolation-angle-with-json-null","sourceArtifactId":"source-path-bounded-finite-angles","sourcePath":"path-bounded-finite-angles.json"}],"certificateHashVerificationIncluded":false,"collisionDetectionIncluded":false,"collisionFreedomEstablished":false,"conservativeAngleBoundsEstablished":false,"contactAnalysisIncluded":false,"continuousCollisionDetectionIncluded":false,"contractStatus":"candidate","creaseMapCompletenessEstablished":false,"cryptographicAuthenticityEstablished":false,"declaredBoundedInterpolationAngleContainmentParserOnly":false,"declaredBoundedInterpolationAngleKnotCardinalityParserOnly":false,"declaredBoundedInterpolationBoundKnotIntervalCardinalityParserOnly":false,"declaredBoundedInterpolationFiniteAnglesParserOnly":true,"declaredBoundedInterpolationFiniteKnotTimesParserOnly":false,"declaredBoundedInterpolationKnotTimeStrictMonotonicityParserOnly":false,"declaredBoundedInterpolationUniqueAngleCreaseRowsParserOnly":false,"declaredBoundedInterpolationUniqueIntervalBoundCreaseRowsParserOnly":false,"declaredPathCandidateRepresentationStatusParserOnly":false,"declaredPathCandidateRepresentationVersionParserOnly":false,"declaredPathCandidateSupportedRepresentationKindParserOnly":false,"endpointContinuityEstablished":false,"faceIsometryEstablished":false,"foldabilityEstablished":false,"generator":{"detector":"parseArtifactContractV1","detectorSourcePath":"m0f/artifacts/contract.ts","generatorId":"oridesign-neg-path-bounded-finite-angles-candidate-bundle","generatorVersion":"1.0.0-candidate","serialization":"stable-json-utf8-lf-v1"},"globalM0fGate":"not-evaluated","hingeGeometryEstablished":false,"kinematicFeasibilityEstablished":false,"motionMapCompletenessEstablished":false,"pathRepresentationCompletenessEstablished":false,"pathTimeCoverageEstablished":false,"physicalAngleBoundsEstablished":false,"physicalAngleScheduleEstablished":false,"physicalPathContinuityEstablished":false,"piecewisePolynomialCardinalityIncluded":false,"piecewisePolynomialEndpointInferenceIncluded":false,"piecewisePolynomialSemanticsEstablished":false,"provenance":{"authors":["OriDesign contributors"],"licenseSpdx":"MIT","redistribution":"allowed","sourceKind":"project-authored","sourceReferenceId":"oridesign-neg-path-bounded-finite-angles-candidate-v1","title":"NEG-PATH-MUTATION-BOUNDED-FINITE-ANGLES project-authored bounded-interpolation finite-angles parser vector"},"radianConventionEstablished":false,"recordType":"m0f-neg-path-bounded-finite-angles-candidate-bundle-ledger","representationSelectionEstablished":false,"rigidityEstablished":false,"schemaId":"https://oridesign.local/schemas/m0f/neg-path-bounded-finite-angles-candidate-bundle-ledger-v1.schema.json","schemaVersion":1,"scientificClaim":false,"scientificVerificationClaimed":false,"scope":"project-authored-exact-negative-artifact-contract-bounded-interpolation-finite-angles-parser-replay-only","supportProfileIncluded":false,"toleranceProfileIncluded":false,"vectorSetId":"NEG-PATH-MUTATION-BOUNDED-FINITE-ANGLES-V1"}
